{
  "$schema": "./schemas/skills-registry.schema.json",
  "name": "agentkits-marketing-skills",
  "version": "2.0.0",
  "description": "Enterprise-grade marketing skills registry with semantic metadata, dependency graphs, and MCP mappings",
  "lastUpdated": "2026-02-01",
  "categories": {
    "core": {
      "description": "Foundational marketing knowledge and frameworks",
      "skills": ["marketing-fundamentals", "marketing-psychology", "marketing-ideas", "seo-mastery", "social-media", "email-marketing", "paid-advertising", "content-strategy", "analytics-attribution", "brand-building", "problem-solving"]
    },
    "cro": {
      "description": "Conversion rate optimization across touchpoints",
      "skills": ["page-cro", "form-cro", "popup-cro", "signup-flow-cro", "onboarding-cro", "paywall-upgrade-cro", "ab-test-setup"]
    },
    "content": {
      "description": "Content creation and copywriting",
      "skills": ["copywriting", "copy-editing", "email-sequence"]
    },
    "seo-growth": {
      "description": "SEO and growth-focused strategies",
      "skills": ["programmatic-seo", "schema-markup", "competitor-alternatives", "launch-strategy", "pricing-strategy", "referral-program", "free-tool-strategy"]
    },
    "document": {
      "description": "Document creation skills",
      "skills": ["document-skills/docx", "document-skills/pdf", "document-skills/pptx", "document-skills/xlsx"]
    }
  },
  "dependencyGraph": {
    "form-cro": ["page-cro"],
    "popup-cro": ["page-cro"],
    "signup-flow-cro": ["form-cro"],
    "onboarding-cro": ["signup-flow-cro"],
    "paywall-upgrade-cro": ["page-cro", "pricing-strategy"],
    "ab-test-setup": ["page-cro", "analytics-attribution"],
    "copy-editing": ["copywriting"],
    "email-sequence": ["email-marketing", "copywriting"],
    "programmatic-seo": ["seo-mastery"],
    "schema-markup": ["seo-mastery"],
    "competitor-alternatives": ["seo-mastery", "copywriting"],
    "launch-strategy": ["content-strategy", "social-media"],
    "referral-program": ["marketing-fundamentals"],
    "free-tool-strategy": ["seo-mastery", "content-strategy"]
  },
  "skills": [
    {
      "id": "marketing-fundamentals",
      "name": "Marketing Fundamentals",
      "path": "marketing-fundamentals/SKILL.md",
      "category": "core",
      "version": "1.0.0",
      "difficulty": "beginner",
      "description": "Core marketing concepts, psychology, and frameworks for effective marketing",
      "triggers": ["marketing basics", "funnel", "TOFU", "MOFU", "BOFU", "customer journey", "positioning", "value proposition", "marketing psychology", "marketing framework"],
      "prerequisites": [],
      "relatedSkills": ["marketing-psychology", "brand-building", "content-strategy"],
      "agents": ["researcher", "brainstormer", "planner"],
      "mcpIntegrations": {
        "required": [],
        "optional": ["google-analytics"]
      },
      "successMetrics": ["funnel_conversion", "customer_acquisition"],
      "hasReferences": true
    },
    {
      "id": "marketing-psychology",
      "name": "Marketing Psychology",
      "path": "marketing-psychology/SKILL.md",
      "category": "core",
      "version": "1.0.0",
      "difficulty": "intermediate",
      "description": "70+ mental models and psychological principles for marketing",
      "triggers": ["psychology", "mental models", "cognitive bias", "persuasion", "behavioral science", "why people buy", "decision-making", "consumer behavior", "first principles", "jobs to be done"],
      "prerequisites": ["marketing-fundamentals"],
      "relatedSkills": ["marketing-fundamentals", "copywriting", "page-cro"],
      "agents": ["brainstormer", "copywriter", "conversion-optimizer"],
      "mcpIntegrations": {
        "required": [],
        "optional": []
      },
      "successMetrics": ["conversion_rate", "engagement_rate"],
      "hasReferences": false
    },
    {
      "id": "marketing-ideas",
      "name": "Marketing Ideas",
      "path": "marketing-ideas/SKILL.md",
      "category": "core",
      "version": "1.0.0",
      "difficulty": "beginner",
      "description": "140+ proven SaaS marketing strategies and tactics",
      "triggers": ["marketing ideas", "growth ideas", "how to market", "marketing strategies", "marketing tactics", "ways to promote", "ideas to grow", "growth hacking"],
      "prerequisites": [],
      "relatedSkills": ["marketing-fundamentals", "content-strategy", "social-media"],
      "agents": ["brainstormer", "planner", "researcher"],
      "mcpIntegrations": {
        "required": [],
        "optional": []
      },
      "successMetrics": ["idea_implementation_rate"],
      "hasReferences": false
    },
    {
      "id": "seo-mastery",
      "name": "SEO Mastery",
      "path": "seo-mastery/SKILL.md",
      "category": "core",
      "version": "1.0.0",
      "difficulty": "intermediate",
      "description": "Search engine optimization strategies for organic growth",
      "triggers": ["SEO", "search optimization", "keyword research", "organic traffic", "rankings", "backlinks", "on-page SEO", "technical SEO", "search intent", "SERP"],
      "prerequisites": ["content-strategy"],
      "relatedSkills": ["programmatic-seo", "schema-markup", "content-strategy"],
      "agents": ["attraction-specialist", "seo-specialist"],
      "mcpIntegrations": {
        "required": [],
        "optional": ["google-search-console", "semrush", "dataforseo"]
      },
      "successMetrics": ["organic_traffic", "keyword_rankings", "domain_authority"],
      "hasReferences": true
    },
    {
      "id": "social-media",
      "name": "Social Media",
      "path": "social-media/SKILL.md",
      "category": "core",
      "version": "1.0.0",
      "difficulty": "intermediate",
      "description": "Social media strategy, content creation, and platform optimization",
      "triggers": ["social media", "Twitter", "LinkedIn", "Instagram", "TikTok", "Facebook", "social content", "engagement", "viral", "algorithm"],
      "prerequisites": ["content-strategy"],
      "relatedSkills": ["content-strategy", "copywriting", "paid-advertising"],
      "agents": ["attraction-specialist", "copywriter"],
      "mcpIntegrations": {
        "required": [],
        "optional": ["twitter"]
      },
      "successMetrics": ["engagement_rate", "follower_growth", "reach"],
      "hasReferences": true
    },
    {
      "id": "email-marketing",
      "name": "Email Marketing",
      "path": "email-marketing/SKILL.md",
      "category": "core",
      "version": "1.0.0",
      "difficulty": "intermediate",
      "description": "Email campaign strategy, automation, and optimization",
      "triggers": ["email marketing", "email campaign", "newsletter", "deliverability", "open rate", "click rate", "email automation", "email list"],
      "prerequisites": ["copywriting"],
      "relatedSkills": ["email-sequence", "copywriting", "analytics-attribution"],
      "agents": ["email-wizard", "copywriter"],
      "mcpIntegrations": {
        "required": [],
        "optional": ["hubspot"]
      },
      "successMetrics": ["open_rate", "click_rate", "conversion_rate", "unsubscribe_rate"],
      "hasReferences": true
    },
    {
      "id": "paid-advertising",
      "name": "Paid Advertising",
      "path": "paid-advertising/SKILL.md",
      "category": "core",
      "version": "1.0.0",
      "difficulty": "intermediate",
      "description": "Paid media strategy across platforms for customer acquisition",
      "triggers": ["paid ads", "PPC", "Google Ads", "Facebook Ads", "Meta Ads", "LinkedIn Ads", "ROAS", "CPC", "CPL", "ad campaign"],
      "prerequisites": ["analytics-attribution"],
      "relatedSkills": ["analytics-attribution", "copywriting", "page-cro"],
      "agents": ["attraction-specialist"],
      "mcpIntegrations": {
        "required": [],
        "optional": ["meta-ads", "google-analytics"]
      },
      "successMetrics": ["ROAS", "CPC", "CPA", "conversion_rate"],
      "hasReferences": true
    },
    {
      "id": "content-strategy",
      "name": "Content Strategy",
      "path": "content-strategy/SKILL.md",
      "category": "core",
      "version": "1.0.0",
      "difficulty": "intermediate",
      "description": "Content planning, creation, and distribution strategy",
      "triggers": ["content strategy", "content calendar", "editorial", "content pillars", "content marketing", "blog strategy", "content distribution"],
      "prerequisites": ["marketing-fundamentals"],
      "relatedSkills": ["seo-mastery", "copywriting", "social-media"],
      "agents": ["planner", "copywriter", "attraction-specialist"],
      "mcpIntegrations": {
        "required": [],
        "optional": ["notion", "asana"]
      },
      "successMetrics": ["content_output", "engagement", "traffic_growth"],
      "hasReferences": true
    },
    {
      "id": "analytics-attribution",
      "name": "Analytics & Attribution",
      "path": "analytics-attribution/SKILL.md",
      "category": "core",
      "version": "1.0.0",
      "difficulty": "advanced",
      "description": "Performance measurement, attribution modeling, and marketing ROI",
      "triggers": ["analytics", "attribution", "tracking", "ROI", "CAC", "LTV", "dashboard", "reporting", "conversion tracking", "marketing metrics"],
      "prerequisites": ["marketing-fundamentals"],
      "relatedSkills": ["ab-test-setup", "paid-advertising"],
      "agents": ["project-manager", "researcher"],
      "mcpIntegrations": {
        "required": [],
        "optional": ["google-analytics", "google-search-console"]
      },
      "successMetrics": ["tracking_accuracy", "attribution_confidence"],
      "hasReferences": true
    },
    {
      "id": "brand-building",
      "name": "Brand Building",